{
  "timestamp": 1786596485921,
  "frame_id": 1,
  "inference_time_ms": 14.73,
  "stream_id": "nano-e2e-low-01",
  "fall_detected": false,
  "fall_event": false,
  "event_id": 0,
  "global_event_id": 0,
  "event_id_scope": "stream_global_event_id",
  "state": "normal",
  "person_detected": true,
  "person_count": 1,
  "fallen_count": 0,
  "tracking": true,
  "features": {
    "valid": true,
    "hip_y": 0.51,
    "hip_drop_speed": 0.0,
    "hip_drop_distance": 0.0,
    "torso_angle_deg": 4.2,
    "bbox_aspect_ratio": 0.44
  },
  "keypoints": [[0.5, 0.2, 0.9], [0.5, 0.25, 0.9], [0.5, 0.3, 0.9], [0.5, 0.35, 0.9], [0.5, 0.4, 0.9], [0.5, 0.45, 0.9], [0.5, 0.5, 0.9], [0.5, 0.55, 0.9], [0.5, 0.6, 0.9], [0.5, 0.65, 0.9], [0.5, 0.7, 0.9], [0.5, 0.75, 0.9], [0.5, 0.8, 0.9], [0.5, 0.85, 0.9], [0.5, 0.9, 0.9], [0.5, 0.92, 0.9], [0.5, 0.94, 0.9]],
  "pose17": [[0.5, 0.2, 0.9], [0.5, 0.25, 0.9], [0.5, 0.3, 0.9], [0.5, 0.35, 0.9], [0.5, 0.4, 0.9], [0.5, 0.45, 0.9], [0.5, 0.5, 0.9], [0.5, 0.55, 0.9], [0.5, 0.6, 0.9], [0.5, 0.65, 0.9], [0.5, 0.7, 0.9], [0.5, 0.75, 0.9], [0.5, 0.8, 0.9], [0.5, 0.85, 0.9], [0.5, 0.9, 0.9], [0.5, 0.92, 0.9], [0.5, 0.94, 0.9]],
  "persons": [{
    "track_id": 1,
    "state": "normal",
    "fall_detected": false,
    "fall_event": false,
    "event_id": 0,
    "person_detected": true,
    "person_score": 0.91,
    "tracking": true,
    "missed_frames": 0,
    "bbox": [0.5, 0.55, 0.22, 0.5],
    "features": {
      "valid": true,
      "hip_y": 0.51,
      "hip_drop_speed": 0.0,
      "hip_drop_distance": 0.0,
      "torso_angle_deg": 4.2,
      "bbox_aspect_ratio": 0.44
    },
    "keypoints": [[0.5, 0.2, 0.9], [0.5, 0.25, 0.9], [0.5, 0.3, 0.9], [0.5, 0.35, 0.9], [0.5, 0.4, 0.9], [0.5, 0.45, 0.9], [0.5, 0.5, 0.9], [0.5, 0.55, 0.9], [0.5, 0.6, 0.9], [0.5, 0.65, 0.9], [0.5, 0.7, 0.9], [0.5, 0.75, 0.9], [0.5, 0.8, 0.9], [0.5, 0.85, 0.9], [0.5, 0.9, 0.9], [0.5, 0.92, 0.9], [0.5, 0.94, 0.9]],
    "pose17": [[0.5, 0.2, 0.9], [0.5, 0.25, 0.9], [0.5, 0.3, 0.9], [0.5, 0.35, 0.9], [0.5, 0.4, 0.9], [0.5, 0.45, 0.9], [0.5, 0.5, 0.9], [0.5, 0.55, 0.9], [0.5, 0.6, 0.9], [0.5, 0.65, 0.9], [0.5, 0.7, 0.9], [0.5, 0.75, 0.9], [0.5, 0.8, 0.9], [0.5, 0.85, 0.9], [0.5, 0.9, 0.9], [0.5, 0.92, 0.9], [0.5, 0.94, 0.9]]
  }]
}
